url	cleaned_url	depth
/w/index.php?title=Special:CategoryTree&target=Abstraction&mode=20&hideprefix=20&showcount=1		0
/w/index.php?title=Special:CategoryTree&target=Categories_requiring_diffusion&mode=20&hideprefix=20&showcount=1		0
/w/index.php?title=Special:CategoryTree&target=Commons_category_link_is_on_Wikidata&mode=20&hideprefix=20&showcount=1		0
/w/index.php?title=Special:CategoryTree&target=Formal_sciences&mode=20&hideprefix=20&showcount=1		0
/w/index.php?title=Special:CategoryTree&target=Main_topic_classifications&mode=20&hideprefix=20&showcount=1		0
/w/index.php?title=Special:CategoryTree&target=Structure&mode=20&hideprefix=20&showcount=1		0
/wiki/Category:Mathematics	Category:Mathematics	0
/wiki/Category:Fields_of_mathematics	Category:Fields of mathematics	0
/wiki/Category:Mathematics-related_lists	Category:Mathematics-related lists	0
/wiki/Category:Mathematicians	Category:Mathematicians	0
/wiki/Category:Mathematical_concepts	Category:Mathematical concepts	0
/wiki/Category:Mathematics_and_culture	Category:Mathematics and culture	0
/wiki/Category:Mathematical_examples	Category:Mathematical examples	0
/wiki/Category:History_of_mathematics	Category:History of mathematics	0
/wiki/Category:Mathematics_and_art	Category:Mathematics and art	0
/wiki/Category:Mathematical_modeling	Category:Mathematical modeling	0
/wiki/Category:Mathematical_notation	Category:Mathematical notation	0
/wiki/Category:Mathematical_science_occupations	Category:Mathematical science occupations	0
/wiki/Category:Philosophy_of_mathematics	Category:Philosophy of mathematics	0
/wiki/Category:Mathematical_projects	Category:Mathematical projects	0
/wiki/Category:Mathematical_proofs	Category:Mathematical proofs	0
/wiki/Category:Pseudomathematics	Category:Pseudomathematics	0
/wiki/Category:Set_indices_on_mathematics	Category:Set indices on mathematics	0
/wiki/Category:Stub-Class_mathematics_pages	Category:Stub-Class mathematics pages	0
/wiki/Category:Mathematical_terminology	Category:Mathematical terminology	0
/wiki/Category:Mathematics_textbooks	Category:Mathematics textbooks	0
/wiki/Category:Mathematical_theorems	Category:Mathematical theorems	0
/wiki/Category:Mathematical_tools	Category:Mathematical tools	0
/wiki/Category:Women_in_mathematics	Category:Women in mathematics	0
/wiki/Category:Wikipedia_books_on_mathematics	Category:Wikipedia books on mathematics	0
/wiki/Category:Mathematics_stubs	Category:Mathematics stubs	0
/wiki/Mathematics	Mathematics	0
/wiki/Portal:Contents/Mathematics_and_logic	Portal:Contents/Mathematics and logic	0
/wiki/Outline_of_mathematics	Outline of mathematics	0
/wiki/Analysis_of_Boolean_functions	Analysis of Boolean functions	0
/wiki/The_Archimedeans	The Archimedeans	0
/wiki/Archives_of_American_Mathematics	Archives of American Mathematics	0
/wiki/Data-driven_control_system	Data-driven control system	0
/wiki/Discrete_Logarithm_Problem_(DLP)	Discrete Logarithm Problem (DLP)	0
/wiki/Legendre_moment	Legendre moment	0
/wiki/Locally_nilpotent_derivation	Locally nilpotent derivation	0
/wiki/Mediation-driven_attachment_model	Mediation-driven attachment model	0
/wiki/Peano_kernel_theorem	Peano kernel theorem	0
/wiki/Proof_School	Proof School	0
/wiki/Quota_rule	Quota rule	0
/wiki/Category:Algebra	Category:Algebra	1
/wiki/Category:Mathematical_analysis	Category:Mathematical analysis	1
/wiki/Category:Applied_mathematics	Category:Applied mathematics	1
/wiki/Category:Arithmetic	Category:Arithmetic	1
/wiki/Category:Calculus	Category:Calculus	1
/wiki/Category:Combinatorics	Category:Combinatorics	1
/wiki/Category:Computational_mathematics	Category:Computational mathematics	1
/wiki/Category:Discrete_mathematics	Category:Discrete mathematics	1
/wiki/Category:Dynamical_systems	Category:Dynamical systems	1
/wiki/Category:Elementary_mathematics	Category:Elementary mathematics	1
/wiki/Category:Experimental_mathematics	Category:Experimental mathematics	1
/wiki/Category:Foundations_of_mathematics	Category:Foundations of mathematics	1
/wiki/Category:Game_theory	Category:Game theory	1
/wiki/Category:Geometry	Category:Geometry	1
/wiki/Category:Graph_theory	Category:Graph theory	1
/wiki/Category:Mathematical_logic	Category:Mathematical logic	1
/wiki/Category:Mathematics_of_infinitesimals	Category:Mathematics of infinitesimals	1
/wiki/Category:Number_theory	Category:Number theory	1
/wiki/Category:Order_theory	Category:Order theory	1
/wiki/Category:Probability_and_statistics	Category:Probability and statistics	1
/wiki/Category:Recreational_mathematics	Category:Recreational mathematics	1
/wiki/Category:Representation_theory	Category:Representation theory	1
/wiki/Category:Topology	Category:Topology	1
/wiki/Areas_of_mathematics	Areas of mathematics	1
/wiki/Glossary_of_areas_of_mathematics	Glossary of areas of mathematics	1
/wiki/Glossary_of_calculus	Glossary of calculus	1
/wiki/Mathematics_Subject_Classification	Mathematics Subject Classification	1
/wiki/Physical_mathematics	Physical mathematics	1
/wiki/Pure_mathematics	Pure mathematics	1
/wiki/Lists_of_mathematics_topics	Lists of mathematics topics	1
/wiki/List_of_q-analogs	List of q-analogs	1
/wiki/List_of_two-dimensional_geometric_shapes	List of two-dimensional geometric shapes	1
/wiki/List_of_mathematical_abbreviations	List of mathematical abbreviations	1
/wiki/List_of_abstract_algebra_topics	List of abstract algebra topics	1
/wiki/Index_of_accounting_articles	Index of accounting articles	1
/wiki/Outline_of_algebra	Outline of algebra	1
/wiki/List_of_algebraic_coding_theory_topics	List of algebraic coding theory topics	1
/wiki/List_of_algebraic_constructions	List of algebraic constructions	1
/wiki/List_of_algebraic_geometry_topics	List of algebraic geometry topics	1
/wiki/List_of_algebraic_number_theory_topics	List of algebraic number theory topics	1
/wiki/Outline_of_algebraic_structures	Outline of algebraic structures	1
/wiki/List_of_complex_and_algebraic_surfaces	List of complex and algebraic surfaces	1
/wiki/List_of_algorithm_general_topics	List of algorithm general topics	1
/wiki/List_of_algorithms	List of algorithms	1
/wiki/List_of_terms_relating_to_algorithms_and_data_structures	List of terms relating to algorithms and data structures	1
/wiki/List_of_aperiodic_sets_of_tiles	List of aperiodic sets of tiles	1
/wiki/Outline_of_arithmetic	Outline of arithmetic	1
/wiki/List_of_mathematical_artists	List of mathematical artists	1
/wiki/List_of_axioms	List of axioms	1
/wiki/Table_of_bases	Table of bases	1
/wiki/List_of_works_by_Nikolay_Bogolyubov	List of works by Nikolay Bogolyubov	1
/wiki/List_of_Boolean_algebra_topics	List of Boolean algebra topics	1
/wiki/List_of_calculus_topics	List of calculus topics	1
/wiki/Outline_of_calculus	Outline of calculus	1
/wiki/Outline_of_category_theory	Outline of category theory	1
/wiki/List_of_chaotic_maps	List of chaotic maps	1
/wiki/List_of_circle_topics	List of circle topics	1
/wiki/List_of_mathematical_topics_in_classical_mechanics	List of mathematical topics in classical mechanics	1
/wiki/List_of_cohomology_theories	List of cohomology theories	1
/wiki/List_of_combinatorial_computational_geometry_topics	List of combinatorial computational geometry topics	1
/wiki/Index_of_combinatorics_articles	Index of combinatorics articles	1
/wiki/List_of_commutative_algebra_topics	List of commutative algebra topics	1
/wiki/Comparison_of_vector_algebra_and_geometric_algebra	Comparison of vector algebra and geometric algebra	1
/wiki/List_of_mathematics_competitions	List of mathematics competitions	1
/wiki/List_of_complex_analysis_topics	List of complex analysis topics	1
/wiki/List_of_complexity_classes	List of complexity classes	1
/wiki/List_of_computability_and_complexity_topics	List of computability and complexity topics	1
/wiki/Computational_complexity_of_mathematical_operations	Computational complexity of mathematical operations	1
/wiki/List_of_computer_algebra_systems	List of computer algebra systems	1
/wiki/List_of_computer_graphics_and_descriptive_geometry_topics	List of computer graphics and descriptive geometry topics	1
/wiki/List_of_mathematical_concepts_named_after_places	List of mathematical concepts named after places	1
/wiki/List_of_conjectures	List of conjectures	1
/wiki/List_of_continuity-related_mathematical_topics	List of continuity-related mathematical topics	1
/wiki/List_of_convexity_topics	List of convexity topics	1
/wiki/List_of_coordinate_charts	List of coordinate charts	1
/wiki/List_of_common_coordinate_transformations	List of common coordinate transformations	1
/wiki/Index_of_cryptography_articles	Index of cryptography articles	1
/wiki/List_of_curves_topics	List of curves topics	1
/wiki/List_of_curves	List of curves	1
/wiki/Differentiation_rules	Differentiation rules	1
/wiki/List_of_derivatives_and_integrals_in_alternative_calculi	List of derivatives and integrals in alternative calculi	1
/wiki/List_of_differential_geometry_topics	List of differential geometry topics	1
/wiki/Outline_of_discrete_mathematics	Outline of discrete mathematics	1
/wiki/List_of_disproved_mathematical_ideas	List of disproved mathematical ideas	1
/wiki/Table_of_divisors	Table of divisors	1
/wiki/List_of_dualities	List of dualities	1
/wiki/List_of_dynamical_systems_and_differential_equations_topics	List of dynamical systems and differential equations topics	1
/wiki/List_of_special_functions_and_eponyms	List of special functions and eponyms	1
/wiki/List_of_equations	List of equations	1
/wiki/List_of_equations_in_classical_mechanics	List of equations in classical mechanics	1
/wiki/List_of_mathematical_examples	List of mathematical examples	1
/wiki/List_of_exceptional_set_concepts	List of exceptional set concepts	1
/wiki/List_of_exponential_topics	List of exponential topics	1
/wiki/Exterior_calculus_identities	Exterior calculus identities	1
/wiki/List_of_factorial_and_binomial_topics	List of factorial and binomial topics	1
/wiki/List_of_finite_simple_groups	List of finite simple groups	1
/wiki/List_of_first-order_theories	List of first-order theories	1
/wiki/List_of_formal_systems	List of formal systems	1
/wiki/List_of_formulas_in_elementary_geometry	List of formulas in elementary geometry	1
/wiki/List_of_Fourier_analysis_topics	List of Fourier analysis topics	1
/wiki/List_of_Fourier-related_transforms	List of Fourier-related transforms	1
/wiki/Index_of_fractal-related_articles	Index of fractal-related articles	1
/wiki/List_of_fractals_by_Hausdorff_dimension	List of fractals by Hausdorff dimension	1
/wiki/List_of_functional_analysis_topics	List of functional analysis topics	1
/wiki/List_of_mathematical_functions	List of mathematical functions	1
/wiki/List_of_types_of_functions	List of types of functions	1
/wiki/List_of_examples_in_general_topology	List of examples in general topology	1
/wiki/List_of_genetic_algorithm_applications	List of genetic algorithm applications	1
/wiki/List_of_geodesic_polyhedra_and_Goldberg_polyhedra	List of geodesic polyhedra and Goldberg polyhedra	1
/wiki/List_of_geometry_topics	List of geometry topics	1
/wiki/Outline_of_geometry	Outline of geometry	1
/wiki/Graduate_Studies_in_Mathematics	Graduate Studies in Mathematics	1
/wiki/Graduate_Texts_in_Mathematics	Graduate Texts in Mathematics	1
/wiki/List_of_graph_theory_topics	List of graph theory topics	1
/wiki/List_of_graphical_methods	List of graphical methods	1
/wiki/List_of_graphs	List of graphs	1
/wiki/List_of_group_theory_topics	List of group theory topics	1
/wiki/List_of_small_groups	List of small groups	1
/wiki/List_of_harmonic_analysis_topics	List of harmonic analysis topics	1
/wiki/List_of_mathematics_history_topics	List of mathematics history topics	1
/wiki/List_of_homological_algebra_topics	List of homological algebra topics	1
/wiki/List_of_mathematical_identities	List of mathematical identities	1
/wiki/List_of_impossible_puzzles	List of impossible puzzles	1
/wiki/List_of_incomplete_proofs	List of incomplete proofs	1
/wiki/Indefinite_product	Indefinite product	1
/wiki/List_of_inequalities	List of inequalities	1
/wiki/Index_of_information_theory_articles	Index of information theory articles	1
/wiki/List_of_definite_integrals	List of definite integrals	1
/wiki/Lists_of_integrals	Lists of integrals	1
/wiki/List_of_integrals_of_inverse_trigonometric_functions	List of integrals of inverse trigonometric functions	1
/wiki/List_of_integrals_of_exponential_functions	List of integrals of exponential functions	1
/wiki/List_of_integrals_of_Gaussian_functions	List of integrals of Gaussian functions	1
/wiki/List_of_integrals_of_hyperbolic_functions	List of integrals of hyperbolic functions	1
/wiki/List_of_integrals_of_inverse_hyperbolic_functions	List of integrals of inverse hyperbolic functions	1
/wiki/List_of_integrals_of_irrational_functions	List of integrals of irrational functions	1
/wiki/List_of_integrals_of_logarithmic_functions	List of integrals of logarithmic functions	1
/wiki/List_of_integrals_of_rational_functions	List of integrals of rational functions	1
/wiki/List_of_integrals_of_trigonometric_functions	List of integrals of trigonometric functions	1
/wiki/List_of_integration_and_measure_theory_topics	List of integration and measure theory topics	1
/wiki/List_of_International_Mathematical_Olympiads	List of International Mathematical Olympiads	1
/wiki/List_of_irreducible_Tits_indices	List of irreducible Tits indices	1
/wiki/List_of_Johnson_solids	List of Johnson solids	1
/wiki/Karp's_21_NP-complete_problems	Karp's 21 NP-complete problems	1
/wiki/List_of_knot_theory_topics	List of knot theory topics	1
/wiki/List_of_mathematical_knots_and_links	List of mathematical knots and links	1
/wiki/List_of_Laplace_transforms	List of Laplace transforms	1
/wiki/List_of_large_cardinal_properties	List of large cardinal properties	1
/wiki/List_of_lemmas	List of lemmas	1
/wiki/List_of_letters_used_in_mathematics_and_science	List of letters used in mathematics and science	1
/wiki/List_of_Lie_groups_topics	List of Lie groups topics	1
/wiki/List_of_simple_Lie_groups	List of simple Lie groups	1
/wiki/Table_of_Lie_groups	Table of Lie groups	1
/wiki/List_of_limits	List of limits	1
/wiki/List_of_linear_algebra_topics	List of linear algebra topics	1
/wiki/List_of_conjectures_by_Paul_Erdős	List of conjectures by Paul Erdős	1
/wiki/List_of_mathematicians_(A)	List of mathematicians (A)	1
/wiki/List_of_mathematicians_(B)	List of mathematicians (B)	1
/wiki/List_of_mathematicians_(C)	List of mathematicians (C)	1
/wiki/List_of_mathematicians_(D)	List of mathematicians (D)	1
/wiki/List_of_mathematicians_(E)	List of mathematicians (E)	1
/wiki/List_of_mathematicians_(F)	List of mathematicians (F)	1
/wiki/List_of_mathematicians_(G)	List of mathematicians (G)	1
/wiki/List_of_mathematicians_(H)	List of mathematicians (H)	1
/wiki/List_of_mathematicians_(I)	List of mathematicians (I)	1
/wiki/List_of_mathematicians_(J)	List of mathematicians (J)	1
/wiki/List_of_mathematicians_(K)	List of mathematicians (K)	1
/wiki/List_of_mathematicians_(L)	List of mathematicians (L)	1
/wiki/List_of_mathematicians_(M)	List of mathematicians (M)	1
/wiki/List_of_mathematicians_(N)	List of mathematicians (N)	1
/wiki/List_of_mathematicians_(O)	List of mathematicians (O)	1
/wiki/List_of_mathematicians_(P)	List of mathematicians (P)	1
/wiki/List_of_mathematicians_(Q)	List of mathematicians (Q)	1
/wiki/List_of_mathematicians_(R)	List of mathematicians (R)	1
/wiki/List_of_mathematicians_(S)	List of mathematicians (S)	1
/wiki/List_of_mathematicians_(T)	List of mathematicians (T)	1
/wiki/List_of_mathematicians_(U)	List of mathematicians (U)	1
/wiki/List_of_mathematicians_(V)	List of mathematicians (V)	1
/wiki/List_of_mathematicians_(W)	List of mathematicians (W)	1
/wiki/List_of_mathematicians_(X)	List of mathematicians (X)	1
/wiki/List_of_mathematicians_(Y)	List of mathematicians (Y)	1
/wiki/List_of_mathematicians_(Z)	List of mathematicians (Z)	1
/wiki/List_of_PPAD-complete_problems	List of PPAD-complete problems	1
/wiki/Index_of_logarithm_articles	Index of logarithm articles	1
/wiki/Index_of_logic_articles	Index of logic articles	1
/wiki/List_of_mathematical_logic_topics	List of mathematical logic topics	1
/wiki/Outline_of_logic	Outline of logic	1
/wiki/List_of_manifolds	List of manifolds	1
/wiki/List_of_Martin_Gardner_Mathematical_Games_columns	List of Martin Gardner Mathematical Games columns	1
/wiki/List_of_mathematical_shapes	List of mathematical shapes	1
/wiki/List_of_mathematical_societies	List of mathematical societies	1
/wiki/List_of_matrices	List of matrices	1
/wiki/List_of_mathematics-based_methods	List of mathematics-based methods	1
/wiki/List_of_works_by_Nicolas_Minorsky	List of works by Nicolas Minorsky	1
/wiki/List_of_multivariable_calculus_topics	List of multivariable calculus topics	1
/wiki/Table_of_Newtonian_series	Table of Newtonian series	1
/wiki/List_of_NP-complete_problems	List of NP-complete problems	1
/wiki/List_of_number_theory_topics	List of number theory topics	1
/wiki/List_of_numeral_system_topics	List of numeral system topics	1
/wiki/List_of_numerical_analysis_software	List of numerical analysis software	1
/wiki/List_of_numerical_libraries	List of numerical libraries	1
/wiki/List_of_numerical_analysis_topics	List of numerical analysis topics	1
/wiki/List_of_numerical_computational_geometry_topics	List of numerical computational geometry topics	1
/wiki/List_of_operator_splitting_topics	List of operator splitting topics	1
/wiki/List_of_mathematic_operators	List of mathematic operators	1
/wiki/List_of_order_theory_topics	List of order theory topics	1
/wiki/List_of_order_structures_in_mathematics	List of order structures in mathematics	1
/wiki/Outline_of_combinatorics	Outline of combinatorics	1
/wiki/List_of_partial_differential_equation_topics	List of partial differential equation topics	1
/wiki/List_of_partition_topics	List of partition topics	1
/wiki/List_of_perfect_numbers	List of perfect numbers	1
/wiki/List_of_periodic_functions	List of periodic functions	1
/wiki/List_of_permutation_topics	List of permutation topics	1
/wiki/List_of_formulae_involving_π	List of formulae involving π	1
/wiki/List_of_topics_related_to_π	List of topics related to π	1
/wiki/List_of_planar_symmetry_groups	List of planar symmetry groups	1
/wiki/List_of_mathematical_properties_of_points	List of mathematical properties of points	1
/wiki/List_of_polygons	List of polygons	1
/wiki/List_of_polygons,_polyhedra_and_polytopes	List of polygons, polyhedra and polytopes	1
/wiki/List_of_convex_regular-faced_polyhedra	List of convex regular-faced polyhedra	1
/wiki/List_of_polyhedral_stellations	List of polyhedral stellations	1
/wiki/List_of_polynomial_topics	List of polynomial topics	1
/wiki/List_of_price_index_formulas	List of price index formulas	1
/wiki/Table_of_prime_factors	Table of prime factors	1
/wiki/List_of_prime_knots	List of prime knots	1
/wiki/List_of_prime_numbers	List of prime numbers	1
/wiki/Catalog_of_articles_in_probability_theory	Catalog of articles in probability theory	1
/wiki/List_of_probability_topics	List of probability topics	1
/wiki/Outline_of_probability	Outline of probability	1
/wiki/Category:Mathematicians_by_award	Category:Mathematicians by award	1
/wiki/Category:Mathematicians_by_century	Category:Mathematicians by century	1
/wiki/Category:Mathematicians_by_city	Category:Mathematicians by city	1
/wiki/Category:Mathematicians_by_ethnicity	Category:Mathematicians by ethnicity	1
/wiki/Category:Mathematicians_by_field	Category:Mathematicians by field	1
/wiki/Category:Mathematicians_by_nationality	Category:Mathematicians by nationality	1
/wiki/Category:Lists_of_mathematicians	Category:Lists of mathematicians	1
/wiki/Category:Women_mathematicians	Category:Women mathematicians	1
/wiki/Category:African_mathematicians	Category:African mathematicians	1
/wiki/Category:Amateur_mathematicians	Category:Amateur mathematicians	1
/wiki/Category:Ancient_mathematicians	Category:Ancient mathematicians	1
/wiki/Category:Fellows_of_the_American_Mathematical_Society	Category:Fellows of the American Mathematical Society	1
/wiki/Category:Fictional_mathematicians	Category:Fictional mathematicians	1
/wiki/Category:Fields_Medalists	Category:Fields Medalists	1
/wiki/Category:Lists_of_things_named_after_mathematicians	Category:Lists of things named after mathematicians	1
/wiki/Category:Mathematicians_involved_with_Mathematische_Annalen	Category:Mathematicians involved with Mathematische Annalen	1
/wiki/Category:Medieval_mathematicians	Category:Medieval mathematicians	1
/wiki/Category:Mental_calculators	Category:Mental calculators	1
/wiki/Category:Wikipedians_with_an_OEIS_account	Category:Wikipedians with an OEIS account	1
/wiki/Category:Mathematician_politicians	Category:Mathematician politicians	1
/wiki/Category:Pseudonymous_mathematicians	Category:Pseudonymous mathematicians	1
/wiki/Category:Second_Wranglers	Category:Second Wranglers	1
/wiki/Category:Senior_Wranglers	Category:Senior Wranglers	1
/wiki/Category:Mathematicians_who_committed_suicide	Category:Mathematicians who committed suicide	1
/wiki/Category:Tarski_lecturers	Category:Tarski lecturers	1
/wiki/Category:Wikipedia_categories_named_after_mathematicians	Category:Wikipedia categories named after mathematicians	1
/wiki/Category:Mathematician_stubs	Category:Mathematician stubs	1
/wiki/Mathematician	Mathematician	1
/wiki/Jonathan_Bennett_(mathematician)	Jonathan Bennett (mathematician)	1
/wiki/Vladimir_Burkov	Vladimir Burkov	1
/wiki/Peter_G._Casazza	Peter G. Casazza	1
/wiki/Askar_Dzhumadildayev	Askar Dzhumadildayev	1
/wiki/Franz_Harress	Franz Harress	1
/wiki/Alexander_Lyudskanov	Alexander Lyudskanov	1
/wiki/Louis_Necker	Louis Necker	1
/wiki/Joseph_Pérès	Joseph Pérès	1
/wiki/Javier_Perez-Capdevila	Javier Perez-Capdevila	1
/wiki/Rudy_Horne	Rudy Horne	1
/wiki/Wilhelm_Winkler	Wilhelm Winkler	1
/wiki/Xu_Yue	Xu Yue	1
/wiki/File:Paul_Lukas_-_1950.jpg	File:Paul Lukas - 1950.jpg	1
/wiki/Category:Algorithms	Category:Algorithms	1
/wiki/Category:Mathematical_axioms	Category:Mathematical axioms	1
/wiki/Category:Basic_concepts_in_set_theory	Category:Basic concepts in set theory	1
/wiki/Category:Mathematical_objects	Category:Mathematical objects	1
/wiki/Category:Mathematical_principles	Category:Mathematical principles	1
/wiki/Category:Quantity	Category:Quantity	1
/wiki/Category:Mathematical_relations	Category:Mathematical relations	1
/wiki/Category:Mathematical_structures	Category:Mathematical structures	1
/wiki/Ackermann's_formula	Ackermann's formula	1
/wiki/Boolean-valued	Boolean-valued	1
/wiki/Canonical_cover	Canonical cover	1
/wiki/Degeneracy_(mathematics)	Degeneracy (mathematics)	1
/wiki/Dimension	Dimension	1
/wiki/Dimensionless_quantity	Dimensionless quantity	1
/wiki/Källén_function	Källén function	1
/wiki/Limiting_case_(mathematics)	Limiting case (mathematics)	1
/wiki/Line_(geometry)	Line (geometry)	1
/wiki/Mathematical_diagram	Mathematical diagram	1
/wiki/Olog	Olog	1
/wiki/Parity_(mathematics)	Parity (mathematics)	1
/wiki/Plane_(geometry)	Plane (geometry)	1
/wiki/Point_(geometry)	Point (geometry)	1
/wiki/Power_law_of_cache_misses	Power law of cache misses	1
/wiki/Sheaf_of_planes	Sheaf of planes	1
/wiki/Taylor_diagram	Taylor diagram	1
/wiki/Turn_(geometry)	Turn (geometry)	1
/wiki/Unit_angle	Unit angle	1
/wiki/Category:Mathematics_by_culture	Category:Mathematics by culture	1
/wiki/Category:Mathematics_awards	Category:Mathematics awards	1
/wiki/Category:Mathematics_books	Category:Mathematics books	1
/wiki/Category:Mathematics_competitions	Category:Mathematics competitions	1
/wiki/Category:Mathematics_conferences	Category:Mathematics conferences	1
/wiki/Category:Documentary_television_series_about_mathematics	Category:Documentary television series about mathematics	1
/wiki/Category:Mathematics_education	Category:Mathematics education	1
/wiki/Category:Ethnomathematicians	Category:Ethnomathematicians	1
/wiki/Category:Fermat's_Last_Theorem	Category:Fermat's Last Theorem	1
/wiki/Category:Mathematical_humor	Category:Mathematical humor	1
/wiki/Category:Mathematics_and_mysticism	Category:Mathematics and mysticism	1
/wiki/Category:Mathematics_of_music	Category:Mathematics of music	1
/wiki/Category:Mathematics-related_topics_in_popular_culture	Category:Mathematics-related topics in popular culture	1
/wiki/Category:Mathematics_organizations	Category:Mathematics organizations	1
/wiki/Category:Mathematical_problems	Category:Mathematical problems	1
/wiki/Category:Mathematics_education_television_series	Category:Mathematics education television series	1
/wiki/Category:Works_about_mathematics	Category:Works about mathematics	1
/wiki/The_Aleph_(short_story)	The Aleph (short story)	1
/wiki/Arcadia_(play)	Arcadia (play)	1
/wiki/Mathematics_and_art	Mathematics and art	1
/wiki/Mathematical_fiction	Mathematical fiction	1
/wiki/A_Disappearing_Number	A Disappearing Number	1
/wiki/Apostolos_Doxiadis	Apostolos Doxiadis	1
/wiki/Erdős–Bacon_number	Erdős–Bacon number	1
/wiki/Ethnocomputing	Ethnocomputing	1
/wiki/Ethnomathematics	Ethnomathematics	1
/wiki/Gauss's_Pythagorean_right_triangle_proposal	Gauss's Pythagorean right triangle proposal	1
/wiki/Im_schwarzen_Walfisch_zu_Askalon	Im schwarzen Walfisch zu Askalon	1
/wiki/Informal_mathematics	Informal mathematics	1
/wiki/Innumeracy_(book)	Innumeracy (book)	1
/wiki/Jorge_Luis_Borges_and_mathematics	Jorge Luis Borges and mathematics	1
/wiki/Lillian_Rosanoff_Lieber	Lillian Rosanoff Lieber	1
/wiki/Lobachevsky_(song)	Lobachevsky (song)	1
/wiki/Math_rock	Math rock	1
/wiki/Math_Suks	Math Suks	1
/wiki/Mathematica:_A_World_of_Numbers..._and_Beyond	Mathematica: A World of Numbers... and Beyond	1
/wiki/Mathematical_folklore	Mathematical folklore	1
/wiki/Mathematical_knowledge_management	Mathematical knowledge management	1
/wiki/Mathematical_maturity	Mathematical maturity	1
/wiki/Mathematics_and_architecture	Mathematics and architecture	1
/wiki/Mathematics_and_fiber_arts	Mathematics and fiber arts	1
/wiki/Music_and_mathematics	Music and mathematics	1
/wiki/Numbers_(TV_series)	Numbers (TV series)	1
/wiki/Octacube_(sculpture)	Octacube (sculpture)	1
